{
  "trace_id": "사회-5-2-2단원-1차시",
  "era": "조선",
  "palette": { "background": "#FBF4E2", "primary": "#3A4A6B" },
  "slides": [
    {
      "index": 1,
      "kind": "표지",
      "title": "조선 후기, 신분이 흔들리다",
      "body": ["사회 5-2 · 2단원 1차시", "교과서 58~61쪽"],
      "covers_activity": null,
      "answer_of": null,
      "speaker_notes": "표지를 띄운 채 출석과 준비물을 확인한다. (1분)"
    },
    {
      "index": 2,
      "kind": "도입",
      "title": "이상하지 않나요?",
      "body": ["조선 후기, 양반의 수가 크게 늘어났습니다."],
      "covers_activity": "A1",
      "answer_of": null,
      "speaker_notes": "발문: 양반은 태어날 때 정해지는데 어떻게 수가 늘 수 있을까요? 예상 답: 몰래 되었다 / 돈을 냈다. (3분)",
      "image_ref": "교과서 p.58 양반 인구 그래프"
    },
    {
      "index": 3,
      "kind": "학습목표",
      "title": "오늘의 학습목표",
      "body": ["조선 후기에 신분 질서가 흔들린 까닭을 설명할 수 있다."],
      "covers_activity": null,
      "answer_of": null,
      "speaker_notes": "학생이 소리 내어 한 번 읽게 한다. (1분)"
    },
    {
      "index": 4,
      "kind": "활동목록",
      "title": "오늘의 수업 활동",
      "body": ["활동 1. 세 가지 자료 살펴보기", "활동 2. 까닭을 한 문장으로 모으기"],
      "covers_activity": null,
      "answer_of": null,
      "speaker_notes": "활동 이름만 읽어 준다. 내용은 아직 말하지 않는다."
    },
    {
      "index": 5,
      "kind": "활동",
      "title": "활동 1 · 혼자 쓰고 짝과 견주기",
      "body": ["공명첩", "납속", "족보 사기"],
      "covers_activity": "A2",
      "answer_of": null,
      "speaker_notes": "생각-쓰기-짝-비교. 혼자 쓰기 6분 → 짝 비교 6분 → 나누기 3분. 다 쓴 학생에게 '누가, 어떻게'를 추가로 묻는다.",
      "image_ref": "교과서 p.59 공명첩 사진"
    },
    {
      "index": 6,
      "kind": "문제",
      "title": "잠깐 확인",
      "body": ["돈을 내고 벼슬 이름을 받은 문서를 무엇이라고 할까요?"],
      "covers_activity": "A2",
      "answer_of": null,
      "speaker_notes": "손을 들게 하지 말고 짝과 먼저 말하게 한 뒤 다음 장을 연다. 정답은 다음 슬라이드."
    },
    {
      "index": 7,
      "kind": "정답",
      "title": "정답",
      "body": ["공명첩"],
      "covers_activity": null,
      "answer_of": 6,
      "speaker_notes": "이름 칸이 비어 있어서 '공명(空名)'이라고 부른다는 점을 덧붙인다."
    },
    {
      "index": 8,
      "kind": "활동",
      "title": "활동 2 · 한 문장으로 모으기",
      "body": ["혼자 한 문장 → 모둠 한 문장 → 번호를 부르면 발표"],
      "covers_activity": "A3",
      "answer_of": null,
      "speaker_notes": "번호순으로. 개인 3분 → 모둠 합의 6분 → 호명 발표 4분. 2~3모둠만 발표시킨다(시간 관리)."
    },
    {
      "index": 9,
      "kind": "정리",
      "title": "오늘 배운 것",
      "body": ["돈으로 신분을 살 수 있게 되면서 조선의 신분 질서가 흔들렸습니다."],
      "covers_activity": "A4",
      "answer_of": null,
      "speaker_notes": "학습목표 문장과 나란히 놓고 비교하게 한다."
    },
    {
      "index": 10,
      "kind": "OX",
      "title": "OX로 확인해요",
      "body": [],
      "covers_activity": "A4",
      "answer_of": null,
      "ox_items": [
        { "statement": "공명첩은 이름이 적혀 있는 임명장이다." },
        { "statement": "납속은 곡식을 내고 신분을 올리는 방법이었다." },
        { "statement": "조선 후기에 양반의 수는 줄어들었다." },
        { "statement": "족보를 사고파는 일이 있었다." }
      ],
      "speaker_notes": "정답: 1번 X(이름이 비어 있다) / 2번 O / 3번 X(늘어났다) / 4번 O. 전원 동시에 손으로 표시하게 한다."
    },
    {
      "index": 11,
      "kind": "차시예고",
      "title": "다음 시간에는",
      "body": ["흔들린 신분 질서 속에서 사람들의 생활은 어떻게 달라졌을까요?"],
      "covers_activity": null,
      "answer_of": null,
      "speaker_notes": "교과서 62쪽을 미리 펴 보게 한다."
    }
  ],
  "footer": "신리초 5-5 수업용 · 외부 배포 금지"
}
